{
  "schemaVersion": 1,
  "workUnit": "W02",
  "state": "LOCAL_CHANGE_VERIFIED",
  "strictStatus": "FAIL",
  "mergeReady": false,
  "baseCommit": "b3760d4b8d6cda03767ab5ffdbb991d7074a17cd",
  "redCommit": "97e867ff7dfb0ca062516c2a707b65f5ea549ba1",
  "branch": "refactor/w02-test-db-guard",
  "generatedAt": "2026-10-21T10:44:49.964856+00:00",
  "checks": [
    {
      "id": "focused-tests",
      "status": "PASS",
      "scope": "신규 tooling 55개와 기존 matches API mock 6개; DB·브라우저 미실행",
      "evidence": [
        ".omx/logs/w02-checks/focused-csp-resolved.json"
      ],
      "counts": {
        "tooling": 55,
        "existingMockRoute": 6,
        "passed": 61
      }
    },
    {
      "id": "typecheck",
      "status": "PASS",
      "scope": "tsc --noEmit --incremental false",
      "evidence": [
        ".omx/logs/w02-checks/typecheck-final-config.json"
      ]
    },
    {
      "id": "lint",
      "status": "PASS",
      "scope": "최종 전체 lint 오류0, 기존경고9",
      "evidence": [
        ".omx/logs/w02-checks/lint-checkpoint.json"
      ],
      "counts": {
        "errors": 0,
        "warnings": 9
      }
    },
    {
      "id": "build",
      "status": "PASS",
      "scope": "최종 CSP 변경 후 로컬 URL·가짜 키를 주입한 npm run build 통과; 운영 빌드·실제 동작 검증 아님",
      "evidence": [
        ".omx/logs/w02-checks/build-config-final.json"
      ]
    },
    {
      "id": "playwright-collection",
      "status": "PASS",
      "scope": "브라우저·DB 실행 없이 시험 수집만 수행",
      "evidence": [
        ".omx/logs/w02-checks/playwright-collection.json"
      ],
      "counts": {
        "files": 13,
        "cases": 77
      }
    },
    {
      "id": "full-suite",
      "status": "FAIL",
      "scope": "최종 직렬 실행에서 session-form의 redirects 시험 실패1개 관찰; 180초 제한으로 전체도 미완료. 원인 미확정/새 회귀 여부 미분류",
      "evidence": [
        ".omx/logs/w02-checks/regression-serial.json",
        ".omx/logs/w02-checks/regression.json",
        ".omx/logs/w02-checks/regression-bounded.json"
      ]
    },
    {
      "id": "mutation",
      "status": "PASS",
      "scope": "최신 동일 55-test snapshot 정상통과, 6개 고장 사본 모두 관련단언실패; 같은엔진 R2이며 독립 V1 아님",
      "evidence": [
        ".omx/artifacts/w02-mutation-final.json"
      ],
      "counts": {
        "baselinePassed": 55,
        "mutantsDetected": 6
      }
    },
    {
      "id": "strict-prerequisites",
      "status": "FAIL",
      "scope": "docs/sot의 필수3개문서와 acceptance-principles-check.sh 없음",
      "evidence": [
        ".omx/logs/valueconnectx-refactor-w02-2026-10-21.json"
      ]
    },
    {
      "id": "file-limit",
      "status": "FAIL",
      "scope": "기존 수정파일 2개가 500줄 초과; 생성물 면제 없음",
      "evidence": [
        ".omx/logs/w02-file-boundary.json"
      ],
      "counts": {
        "existingOverLimitFiles": 2
      }
    },
    {
      "id": "independent-v1",
      "status": "NOT_RUN",
      "scope": "외부 Claude 180초 및 OAuth경로 재시도120초 응답없음",
      "evidence": [
        ".omx/logs/w02-checks/independent-v1.json",
        ".omx/logs/w02-checks/independent-v1-oauth-retry.json"
      ]
    },
    {
      "id": "v2-chain",
      "status": "NOT_RUN",
      "scope": "독립 V1 판정이 없으므로 재현 연쇄 미완료; 같은엔진 새맥락 리뷰로 대체하지 않음",
      "evidence": []
    },
    {
      "id": "live-db-browser",
      "status": "NOT_RUN",
      "scope": "실제 DB·RLS·GRANT·브라우저 전수 클릭·배포 실행 없음",
      "evidence": []
    }
  ],
  "pending": [
    {
      "id": "W02b",
      "exitCondition": "seed/cleanup의 DB 오류객체·예외 nonzero 종료, 무관행보존, 성공로그 오판방지, 기존초과파일 책임분리"
    },
    {
      "id": "W05",
      "exitCondition": "격리 DB migration/RLS/GRANT/생성타입과 실제역할별읽기쓰기 대조"
    },
    {
      "id": "W00-W06",
      "exitCondition": "정본초안충돌검토와 CI검사계약 승인·실행, 전체시험과 독립검증 공백해소"
    }
  ],
  "changedFiles": [
    "config/test-database.json",
    "docs/engineering/refactor-w02-result-2026-10-21.json",
    "docs/engineering/refactor-w02-result.schema.json",
    "docs/engineering/test-db-boundary-goal-2026-10-21.md",
    "docs/runbook/test-database.md",
    "e2e/global-setup.ts",
    "e2e/helpers/seed.ts",
    "e2e/slice/p2-s1-cold-start.spec.ts",
    "e2e/slice/p2-s2-ai-brief-v2.spec.ts",
    "e2e/slice/p2-s3-community.spec.ts",
    "e2e/slice/s1-invite-onboarding.spec.ts",
    "e2e/slice/s3-directory.spec.ts",
    "e2e/slice/s4-coffeechat-brief.spec.ts",
    "e2e/slice/s4-coffeechat.spec.ts",
    "e2e/slice/s5-feedback.spec.ts",
    "next.config.mjs",
    "playwright.config.ts",
    "scripts/seed-dummy-data.ts",
    "src/__tests__/tooling/database-safety.test.ts",
    "src/__tests__/tooling/development-csp.test.ts",
    "src/__tests__/tooling/seed-cli-safety.test.ts",
    "src/__tests__/tooling/slice-database-safety.test.ts",
    "src/lib/testing/database.ts"
  ],
  "evidenceLimitations": [
    "원문 .omx 경로는 Git 무시 대상이며 커밋 복제만으로 전달되지 않습니다.",
    "동일엔진 하위 검토와 mutation은 독립 V1 증거가 아닙니다.",
    "허용된 로컬 주소도 운영 DB 프록시·터널이나 실제 데이터 격리를 보장하지 않습니다.",
    "기존 Proposed Phase2 PRD·승인 카피·보상/요율·고객링크 정책은 미변경/미확정입니다."
  ]
}
